<?xml version="1.0" encoding="UTF-8"?>
<!DOCTYPE menu PUBLIC "-//CREATE Lab//TeRK//Menu//EN" "http://www.createlab.ri.cmu.edu/dtd/terk/menu/menu.dtd">

<menu welcome-text="Welcome to Vex!    IFI, Inc.">
   <item text="Audio">
      <item text="Set Volume">
         <item text="">
            <implementation-class name="SetVolumeMenuItemAction" library="libAudioMenuItemActions.so"/>
         </item>
      </item>
      <item text="Toggle Audio  Alerts">
         <item text="">
            <implementation-class name="ToggleAudioAlertsMenuItemAction" library="libAudioMenuItemActions.so">
               <property key="action.prompt">Enable Alerts?</property>
               <property key="choice.option1">Yes     </property>
               <property key="choice.option2">No</property>
               <property key="action.option1">Audio alerts    enabled.</property>
               <property key="action.option2">Audio alerts    disabled.</property>
            </implementation-class>
         </item>
      </item>
      <item text="Reset Audio">
         <item text="">
            <implementation-class name="ResetAudioMenuItemAction" library="libAudioMenuItemActions.so">
               <property key="action.prompt">Reset Audio?</property>
               <property key="choice.option1">OK  </property>
               <property key="choice.option2">Cancel</property>
               <property key="action.option1">Audio reset to  factory defaults</property>
               <property key="action.option2">Cancelled!</property>
            </implementation-class>
         </item>
      </item>
   </item>
   <item text="Servos">
      <item text="View/Edit     Servo Configs">
         <item text="">
            <implementation-class name="ViewAndEditServoConfigsMenuItemAction" library="libServoMenuItemActions.so"/>
         </item>
      </item>
      <item text="Reset Servos">
         <item text="">
            <implementation-class name="ResetServosMenuItemAction" library="libServoMenuItemActions.so">
               <property key="action.prompt">Reset Servos?</property>
               <property key="choice.option1">OK  </property>
               <property key="choice.option2">Cancel</property>
               <property key="action.option1">Servos reset to factory defaults</property>
               <property key="action.option2">Cancelled!</property>
            </implementation-class>
         </item>
      </item>
   </item>
   <item text="Factory Reset">
      <item text="Reset Audio">
         <item text="">
            <implementation-class name="ResetAudioMenuItemAction" library="libAudioMenuItemActions.so">
               <property key="action.prompt">Reset Audio?</property>
               <property key="choice.option1">OK  </property>
               <property key="choice.option2">Cancel</property>
               <property key="action.option1">Audio reset to  factory defaults</property>
               <property key="action.option2">Cancelled!</property>
            </implementation-class>
         </item>
      </item>
      <item text="Reset Motors">
         <item text="">
            <implementation-class name="ResetMotorsMenuItemAction">
               <property key="action.prompt">Reset Motors?</property>
               <property key="choice.option1">OK  </property>
               <property key="choice.option2">Cancel</property>
               <property key="action.option1">Motors reset to factory defaults</property>
               <property key="action.option2">Cancelled!</property>
            </implementation-class>
         </item>
      </item>
      <item text="Reset Network">
         <item text="">
            <implementation-class name="ResetNetworkMenuItemAction">
               <property key="action.prompt">Reset Network?</property>
               <property key="choice.option1">OK  </property>
               <property key="choice.option2">Cancel</property>
               <property key="action.option1">Network reset tofactory defaults</property>
               <property key="action.option2">Cancelled!</property>
            </implementation-class>
         </item>
      </item>
      <item text="Reset Servos">
         <item text="">
            <implementation-class name="ResetServosMenuItemAction" library="libServoMenuItemActions.so">
               <property key="action.prompt">Reset Servos?</property>
               <property key="choice.option1">OK  </property>
               <property key="choice.option2">Cancel</property>
               <property key="action.option1">Servos reset to factory defaults</property>
               <property key="action.option2">Cancelled!</property>
            </implementation-class>
         </item>
      </item>
      <item text="Reset All">
         <item text="">
            <implementation-class name="ResetAllMenuItemAction">
               <property key="action.prompt">Reset All?</property>
               <property key="choice.option1">OK  </property>
               <property key="choice.option2">Cancel</property>
               <property key="action.option1">Reset to factorydefaults</property>
               <property key="action.option2">Cancelled!</property>
            </implementation-class>
         </item>
      </item>
   </item>
   <item text="System Info">
      <item text="Firmware             Version">
         <item text="">
            <implementation-class name="FirmwareVersionMenuItemAction" library="libSystemInfoMenuItemActions.so">
               <property key="label">Firmware version</property>
            </implementation-class>
         </item>
      </item>
      <item text="Hardware             Version">
         <item text="">
            <implementation-class name="HardwareVersionMenuItemAction" library="libSystemInfoMenuItemActions.so">
               <property key="label">Hardware version</property>
            </implementation-class>
         </item>
      </item>
   </item>
</menu>
